[
  {
    "key": "binding",
    "label": "Enacted law or binding COP instrument",
    "color": "#1d63d5",
    "definition": "Enacted dedicated laws, regulations, or binding child online protection instruments are in force."
  },
  {
    "key": "draft",
    "label": "Advanced draft pathway",
    "color": "#fc6906",
    "definition": "A draft bill, draft law, or primary legislative pathway is in motion."
  },
  {
    "key": "strategy",
    "label": "Strategy, guideline, or policy only",
    "color": "#f0b26a",
    "definition": "A dedicated strategy, guideline, or policy exists without primary legislative backing."
  },
  {
    "key": "general",
    "label": "General legal coverage",
    "color": "#d9c9aa",
    "definition": "Broader cybercrime, penal, telecom, data protection, or child protection frameworks provide only partial relevance."
  },
  {
    "key": "none",
    "label": "No identifiable framework",
    "color": "#f00614",
    "definition": "No specific legislation, regulation, or policy framework on child online safety is identified."
  }
]
